name,type,status
J81 Edema pulmonar,clinical problems,1  
J82 Eosinofilia pulmonar, no clasificada en otra parte,clinical problems,1  
J84 Otras enfermedades pulmonares intersticiales,clinical problems,1  
J85 Absceso del pulmón y del mediastino,clinical problems,1  
J86 Piotórax,clinical problems,1  
J90 Derrame pleural no clasificado en otra parte,clinical problems,1  
J91 Derrame pleural en enfermedades clasificadas en otra parte,clinical problems,1  
J92 Derrame pleural residual,clinical problems,1  
J93 Neumotórax,clinical problems,1  
J94 Otros trastornos de la pleura,clinical problems,1  
J95 Trastornos respiratorios postprocedimiento,clinical problems,1  
J96 Insuficiencia respiratoria,clinical problems,1  
J98 Otros trastornos respiratorios,clinical problems,1  
J99 Trastornos respiratorios en enfermedades clasificadas en otra parte,clinical problems,1  
K00 Trastornos del desarrollo y de la erupción de los dientes,clinical problems,1  
K01 Dientes incluidos e impactados,clinical problems,1  
K02 Caries dental,clinical problems,1  
K03 Otras enfermedades de los tejidos duros de los dientes,clinical problems,1  
K04 Enfermedades de la pulpa y de los tejidos periapicales,clinical problems,1  
K05 Gingivitis y enfermedades periodontales,clinical problems,1  
K06 Otros trastornos de las encías y del reborde alveolar,clinical problems,1  
K07 Anomalías dentofaciales,clinical problems,1  
K08 Otros trastornos de los dientes y de sus estructuras de sostén,clinical problems,1  
K09 Quistes de la región bucal no clasificados en otra parte,clinical problems,1  
K10 Otras enfermedades de los maxilares,clinical problems,1  
K11 Enfermedades de las glándulas salivales,clinical problems,1  
K12 Estomatitis y lesiones afines,clinical problems,1  
K13 Otras enfermedades de los labios y de la mucosa bucal,clinical problems,1  
K14 Enfermedades de la lengua,clinical problems,1  
K20 Esofagitis,clinical problems,1  
K21 Enfermedad por reflujo gastroesofágico,clinical problems,1  
K22 Otros trastornos del esófago,clinical problems,1  
K23 Trastornos del esófago en enfermedades clasificadas en otra parte,clinical problems,1  
K25 Úlcera gástrica,clinical problems,1  
K26 Úlcera duodenal,clinical problems,1  
K27 Úlcera péptica, sitio no especificado,clinical problems,1  
K28 Úlcera gastroyeyunal,clinical problems,1  
K29 Gastritis y duodenitis,clinical problems,1  
K30 Dispepsia,clinical problems,1  
K31 Otros trastornos del estómago y del duodeno,clinical problems,1  
K35 Apendicitis aguda,clinical problems,1  
K36 Otras apendicitis,clinical problems,1  
K37 Apendicitis no especificada,clinical problems,1  
K38 Otras enfermedades del apéndice,clinical problems,1  
K40 Hernia inguinal,clinical problems,1  
K41 Hernia femoral,clinical problems,1  
K42 Hernia umbilical,clinical problems,1  
K43 Hernia ventral,clinical problems,1  
K44 Hernia diafragmática,clinical problems,1  
K45 Otras hernias abdominales,clinical problems,1  
K46 Hernia abdominal no especificada,clinical problems,1  
K50 Enfermedad de Crohn,clinical problems,1  
K51 Colitis ulcerativa,clinical problems,1  
K52 Otras colitis no infecciosas,clinical problems,1  
K55 Trastornos vasculares del intestino,clinical problems,1  
K56 Íleo y obstrucción intestinal sin hernia,clinical problems,1  
K57 Enfermedad diverticular del intestino,clinical problems,1  
K58 Síndrome del intestino irritable,clinical problems,1  
K59 Otros trastornos funcionales del intestino,clinical problems,1  
K60 Fisura y fístula del ano y del recto,clinical problems,1  
K61 Absceso del ano y del recto,clinical problems,1  
K62 Otros trastornos del ano y del recto,clinical problems,1  
K63 Otros trastornos del intestino,clinical problems,1  
K65 Peritonitis,clinical problems,1  
K66 Otros trastornos del peritoneo,clinical problems,1  
K67 Trastornos del peritoneo en enfermedades clasificadas en otra parte,clinical problems,1  
K70 Enfermedad hepática alcohólica,clinical problems,1  
K71 Hepatitis tóxica,clinical problems,1  
K72 Insuficiencia hepática no clasificada en otra parte,clinical problems,1  
K73 Hepatitis crónica,clinical problems,1  
K74 Fibrosis y cirrosis hepáticas,clinical problems,1  
K75 Otras enfermedades inflamatorias del hígado,clinical problems,1  
K76 Otras enfermedades del hígado,clinical problems,1  
K77 Trastornos del hígado en enfermedades clasificadas en otra parte,clinical problems,1  
K80 Colelitiasis,clinical problems,1  
K81 Colecistitis,clinical problems,1  
K82 Otros trastornos de la vesícula biliar,clinical problems,1  
K83 Otros trastornos de las vías biliares,clinical problems,1  
K85 Pancreatitis aguda,clinical problems,1  
K86 Otros trastornos del páncreas,clinical problems,1  
K87 Trastornos de la vesícula biliar, de las vías biliares y del páncreas en enfermedades clasificadas en otra parte,clinical problems,1  
K90 Malabsorción intestinal,clinical problems,1  
K91 Trastornos del aparato digestivo postprocedimiento,clinical problems,1  
K92 Otros trastornos del aparato digestivo,clinical problems,1  
K93 Trastornos del sistema digestivo en enfermedades clasificadas en otra parte,clinical problems,1  
L00 Síndrome estafilocócico de la piel escaldada,clinical problems,1  
L01 Impétigo,clinical problems,1  
L02 Absceso cutáneo, furúnculo y antrax,clinical problems,1  
L03 Celulitis aguda,clinical problems,1  
L04 Linfadenitis aguda,clinical problems,1  
L05 Pilonidal,clinical problems,1  
L08 Otras infecciones localizadas de la piel y del tejido subcutáneo,clinical problems,1  
L10 Penfigo,clinical problems,1  
L11 Otras enfermedades ampollosas,clinical problems,1  
L12 Penfigoide,clinical problems,1  
L13 Otras afecciones ampollosas,clinical problems,1  
L14 Afecciones ampollosas en enfermedades clasificadas en otra parte,clinical problems,1  
L20 Dermatitis atópica,clinical problems,1  
L21 Dermatitis seborreica,clinical problems,1  
L22 Dermatitis del pañal,clinical problems,1  
L23 Dermatitis alérgica de contacto,clinical problems,1  
L24 Dermatitis irritativa de contacto,clinical problems,1  
L25 Dermatitis de contacto no especificada,clinical problems,1  
L26 Dermatitis exfoliativa,clinical problems,1  
L27 Dermatitis debida a sustancias ingeridas,clinical problems,1  
L28 Liquen simple crónico y prurigo,clinical problems,1  
L29 Prurito,clinical problems,1  
L30 Otras dermatitis,clinical problems,1  
L40 Psoriasis,clinical problems,1  
L41 Parapsoriasis,clinical problems,1  
L42 Pitiriasis rosada,clinical problems,1  
L43 Liquen plano,clinical problems,1  
L44 Otros trastornos papuloescamosos,clinical problems,1  
L45 Trastornos papuloescamosos en enfermedades clasificadas en otra parte,clinical problems,1  
L50 Urticaria,clinical problems,1  
L51 Eritema multiforme,clinical problems,1  
L52 Eritema nudoso,clinical problems,1  
L53 Otros eritemas,clinical problems,1  
L54 Eritema en enfermedades clasificadas en otra parte,clinical problems,1  
L55 Quemadura solar,clinical problems,1  
L56 Otras afecciones de la piel y del tejido subcutáneo relacionadas con la radiación,clinical problems,1  
L57 Trastornos de la piel y del tejido subcutáneo relacionados con la exposición crónica a radiación no ionizante,clinical problems,1  
L58 Trastornos de la piel y del tejido subcutáneo debidos a radiación,clinical problems,1  
L59 Otros trastornos de la piel y del tejido subcutáneo relacionados con causas externas,clinical problems,1  
L60 Trastornos de las uñas,clinical problems,1  
L62 Trastornos de las uñas en enfermedades clasificadas en otra parte,clinical problems,1  
L63 Alopecia areata,clinical problems,1  
L64 Alopecia androgénica,clinical problems,1  
L65 Otras formas de pérdida de cabello no cicatricial,clinical problems,1  
L66 Alopecia cicatricial,clinical problems,1  
L67 Trastornos del color y de la estructura del cabello,clinical problems,1  
L68 Hipertricosis,clinical problems,1  
L70 Acné,clinical problems,1  
L71 Rosácea,clinical problems,1  
L72 Quistes foliculares de la piel y del tejido subcutáneo,clinical problems,1  
L73 Otras afecciones de los folículos pilosos,clinical problems,1  
L74 Trastornos de las glándulas sudoríparas ecrinas,clinical problems,1  
L75 Trastornos de las glándulas sudoríparas apocrinas,clinical problems,1  
L80 Vitiligo,clinical problems,1  
L81 Otros trastornos de la pigmentación,clinical problems,1  
L82 Queratosis seborreica,clinical problems,1  
L83 Acantosis nigricans,clinical problems,1  
L84 Heloma y callosidad,clinical problems,1  
L85 Otros trastornos de la queratinización,clinical problems,1  
L86 Trastornos de la queratinización en enfermedades clasificadas en otra parte,clinical problems,1  
L87 Trastornos granulomatosos de la piel y del tejido subcutáneo,clinical problems,1  
L88 Pioderma gangrenoso,clinical problems,1  
L89 Úlcera por presión,clinical problems,1  
L90 Trastornos atróficos de la piel,clinical problems,1  
L91 Otras afecciones hipertróficas de la piel,clinical problems,1  
L92 Otras afecciones localizadas de la piel y del tejido subcutáneo,clinical problems,1  
L93 Lupus eritematoso,clinical problems,1  
L94 Otras afecciones de la piel y del tejido subcutáneo relacionadas con enfermedades autoinmunitarias,clinical problems,1  
L95 Vasculitis limitada a la piel,clinical problems,1  
L97 Úlcera de la pierna no clasificada en otra parte,clinical problems,1  
L98 Otros trastornos de la piel y del tejido subcutáneo no clasificados en otra parte,clinical problems,1  
L99 Trastornos de la piel y del tejido subcutáneo en enfermedades clasificadas en otra parte,clinical problems,1  
M00 Artritis piogénica,clinical problems,1  
M01 Artritis directa en enfermedades infecciosas,clinical problems,1  
M02 Artropatías postinfecciosas y reactivas,clinical problems,1  
M03 Artropatías en enfermedades infecciosas clasificadas en otra parte,clinical problems,1  
M05 Artritis reumatoide seropositiva,clinical problems,1  
M06 Otras artritis reumatoides,clinical problems,1  
M07 Artropatías psoriásicas y enteropáticas,clinical problems,1  
M08 Artritis juvenil,clinical problems,1  
M09 Artritis juvenil en enfermedades clasificadas en otra parte,clinical problems,1  
M10 Gota,clinical problems,1  
M11 Otras artropatías por cristales,clinical problems,1  
M12 Otras artropatías especificadas,clinical problems,1  
M13 Otras artritis,clinical problems,1  
M14 Artropatías en enfermedades endocrinas, metabólicas y nutricionales,clinical problems,1  
M15 Poliartrosis,clinical problems,1  
M16 Coxartrosis [artrosis de la cadera],clinical problems,1  
M17 Gonartrosis [artrosis de la rodilla],clinical problems,1  
M18 Artrosis de la primera articulación carpometacarpiana,clinical problems,1  
M19 Otras artrosis,clinical problems,1  
M20 Deformidades adquiridas de los dedos de manos y pies,clinical problems,1  
M21 Otras deformidades adquiridas de los miembros,clinical problems,1  
M22 Trastornos de la rótula,clinical problems,1  
M23 Trastornos internos de la rodilla,clinical problems,1  
M24 Otras afecciones articulares especificadas,clinical problems,1  
M25 Otras afecciones articulares no clasificadas en otra parte,clinical problems,1  
M30 Poliarteritis nodosa y afecciones relacionadas,clinical problems,1  
M31 Otras vasculopatías necrosantes,clinical problems,1  
M32 Lupus eritematoso sistémico,clinical problems,1  
M33 Dermatomiositis y polimiositis,clinical problems,1  
M34 Esclerosis sistémica,clinical problems,1  
M35 Otros trastornos sistémicos del tejido conjuntivo,clinical problems,1  
M36 Trastornos sistémicos del tejido conjuntivo en enfermedades clasificadas en otra parte,clinical problems,1  
M40 Cifosis y lordosis,clinical problems,1  
M41 Escoliosis,clinical problems,1  
M42 Osteocondrosis de la columna vertebral,clinical problems,1  
M43 Otros trastornos de la columna vertebral,clinical problems,1  
M45 Espondilitis anquilosante,clinical problems,1  
M46 Otras espondilopatías inflamatorias,clinical problems,1  
M47 Espondilosis,clinical problems,1  
M48 Otros trastornos de los discos intervertebrales,clinical problems,1  
M49 Espondilopatías en enfermedades clasificadas en otra parte,clinical problems,1  
M50 Trastornos cervicales de los discos intervertebrales,clinical problems,1  
M51 Otros trastornos de los discos intervertebrales,clinical problems,1  
M53 Otras dorsopatías no clasificadas en otra parte,clinical problems,1  
M54 Dorsalgia,clinical problems,1  
M60 Miositis,clinical problems,1  
M61 Otras afecciones inflamatorias del músculo,clinical problems,1  
M62 Otros trastornos del músculo,clinical problems,1  
M63 Trastornos del músculo en enfermedades clasificadas en otra parte,clinical problems,1  
M65 Sinovitis y tenosinovitis,clinical problems,1  
M66 Rotura espontánea de sinovia y tendones,clinical problems,1  
M67 Otros trastornos de la sinovia y del tendón,clinical problems,1  
M68 Trastornos de la sinovia y del tendón en enfermedades clasificadas en otra parte,clinical problems,1  
M70 Trastornos de tejidos blandos relacionados con el uso, el uso excesivo y la presión,clinical problems,1  
M71 Otras bursopatías,clinical problems,1  
M72 Trastornos fibroblásticos,clinical problems,1  
M73 Trastornos de los tejidos blandos en enfermedades clasificadas en otra parte,clinical problems,1  
M75 Lesiones del hombro,clinical problems,1  
M76 Entesopatías de los miembros inferiores,clinical problems,1  
M77 Otras entesopatías,clinical problems,1  
M79 Otros trastornos de los tejidos blandos,clinical problems,1  
M80 Osteoporosis con fractura patológica,clinical problems,1  
M81 Osteoporosis sin fractura patológica,clinical problems,1  
M82 Osteoporosis en enfermedades clasificadas en otra parte,clinical problems,1  
M83 Osteomalacia del adulto,clinical problems,1  
M84 Trastornos de la continuidad del hueso,clinical problems,1  
M85 Otros trastornos de la densidad y estructura óseas,clinical problems,1  
M86 Osteomielitis,clinical problems,1  
M87 Osteonecrosis,clinical problems,1  
M88 Enfermedad de Paget del hueso [osteítis deformante],clinical problems,1  
M89 Otros trastornos del hueso,clinical problems,1  
M90 Trastornos óseos en enfermedades clasificadas en otra parte,clinical problems,1  
M91 Osteocondrosis juvenil de la cabeza femoral,clinical problems,1  
M92 Otras osteocondrosis juveniles,clinical problems,1  
M93 Otras osteocondropatías,clinical problems,1  
M94 Otros trastornos del cartílago,clinical problems,1  
M95 Otros trastornos adquiridos del sistema osteomuscular y del tejido conjuntivo,clinical problems,1  
M99 Trastornos biomecánicos no clasificados en otra parte,clinical problems,1  
N00 Síndrome nefrítico agudo,clinical problems,1  
N01 Síndrome nefrítico rápidamente progresivo,clinical problems,1  
N02 Hematuria recurrente y persistente,clinical problems,1  
N03 Síndrome nefrítico crónico,clinical problems,1  
N04 Síndrome nefrótico,clinical problems,1  
N05 Síndrome nefrótico no especificado como agudo o crónico,clinical problems,1  
N06 Proteinuria persistente sin síndrome nefrótico,clinical problems,1  
N07 Nefropatía hereditaria,clinical problems,1  
N08 Trastornos glomerulares en enfermedades clasificadas en otra parte,clinical problems,1  
N10 Nefritis tubulointersticial aguda,clinical problems,1  
N11 Nefritis tubulointersticial crónica,clinical problems,1  
N12 Nefritis tubulointersticial, no especificada como aguda o crónica,clinical problems,1  
N13 Uropatía obstructiva y por reflujo,clinical problems,1  
N14 Trastornos renales y ureterales inducidos por fármacos y metales pesados,clinical problems,1  
N15 Otras afecciones renales tubulointersticiales,clinical problems,1  
N16 Trastornos renales tubulointersticiales en enfermedades clasificadas en otra parte,clinical problems,1  
N17 Insuficiencia renal aguda,clinical problems,1  
N18 Enfermedad renal crónica,clinical problems,1  
N19 Insuficiencia renal no especificada,clinical problems,1  
N20 Cálculo del riñón y del uréter,clinical problems,1  
N21 Cálculo de las vías urinarias inferiores,clinical problems,1  
N22 Cálculos urinarios en enfermedades clasificadas en otra parte,clinical problems,1  
N23 Cólico nefrítico,clinical problems,1  
N25 Trastornos tubulares y afecciones renales metabólicas,clinical problems,1  
N26 Riñón contraído, no especificado,clinical problems,1  
N27 Riñón pequeño de causa no especificada,clinical problems,1  
N28 Otras afecciones del riñón y del uréter,clinical problems,1  
N29 Trastornos del riñón y del uréter en enfermedades clasificadas en otra parte,clinical problems,1  
N30 Cistitis,clinical problems,1  
N31 Trastornos funcionales de la vejiga,clinical problems,1  
N32 Otras afecciones de la vejiga,clinical problems,1  
N33 Trastornos de la vejiga en enfermedades clasificadas en otra parte,clinical problems,1  
N34 Uretritis y síndrome uretral,clinical problems,1  
N35 Estenosis de la uretra,clinical problems,1  
N36 Otras afecciones de la uretra,clinical problems,1  
N37 Trastornos de la uretra en enfermedades clasificadas en otra parte,clinical problems,1  
N39 Otros trastornos del sistema urinario,clinical problems,1  
N40 Hiperplasia de la próstata,clinical problems,1  
N41 Inflamación de la próstata,clinical problems,1  
N42 Otras afecciones de la próstata,clinical problems,1  
N43 Hidrocele y espermatocele,clinical problems,1  
N44 Torsión del testículo,clinical problems,1  
N45 Orquitis y epididimitis,clinical problems,1  
N46 Infertilidad masculina,clinical problems,1  
N47 Trastornos del prepucio,clinical problems,1  
N48 Otros trastornos del pene,clinical problems,1  
N49 Trastornos inflamatorios de los órganos genitales masculinos,clinical problems,1  
N50 Otras afecciones de los órganos genitales masculinos,clinical problems,1  
N60 Enfermedades benignas de la mama,clinical problems,1  
N61 Trastornos inflamatorios de la mama,clinical problems,1  
N62 Hipertrofia de la mama,clinical problems,1  
N63 Masa o bulto no especificado en la mama,clinical problems,1  
N64 Otros trastornos de la mama,clinical problems,1  
N70 Salpingitis y ooforitis,clinical problems,1  
N71 Enfermedad inflamatoria del útero,clinical problems,1  
N72 Enfermedad inflamatoria del cuello uterino,clinical problems,1  
N73 Otras enfermedades inflamatorias de los órganos genitales femeninos,clinical problems,1  
N74 Trastornos inflamatorios de los órganos genitales femeninos en enfermedades clasificadas en otra parte,clinical problems,1  
N75 Enfermedades de las glándulas de Bartolino,clinical problems,1  
N76 Otras enfermedades inflamatorias de la vagina y de la vulva,clinical problems,1  
N77 Lesiones ulcerativas y trastornos inflamatorios en enfermedades clasificadas en otra parte,clinical problems,1  
N80 Endometriosis,clinical problems,1  
N81 Prolapso de órganos pélvicos femeninos,clinical problems,1  
N82 Fístulas genitales femeninas,clinical problems,1  
N83 Otros trastornos no inflamatorios del ovario, trompa de Falopio y ligamento ancho,clinical problems,1  
N84 Pólipo del tracto genital femenino,clinical problems,1  
N85 Otros trastornos no inflamatorios del útero,clinical problems,1  
N86 Erosión y ectropión del cuello uterino,clinical problems,1  
N87 Displasia del cuello uterino,clinical problems,1  
N88 Otros trastornos no inflamatorios del cuello uterino,clinical problems,1  
N89 Otros trastornos no inflamatorios de la vagina,clinical problems,1  
N90 Otros trastornos no inflamatorios de la vulva y del periné,clinical problems,1  
N91 Menstruación ausente escasa o poco frecuente,clinical problems,1
N92 Menstruación excesiva frecuente e irregular,clinical problems,1 
N93 Otros sangrados uterinos y vaginales anormales,clinical problems,1  
N94 Dolor y otros trastornos relacionados con los órganos genitales femeninos y el ciclo menstrual,clinical problems,1  
N95 Otros trastornos menopáusicos y perimenopáusicos,clinical problems,1  
N96 Pérdida habitual del embarazo,clinical problems,1  
N97 Infertilidad femenina,clinical problems,1  
N98 Complicaciones asociadas a la fecundación artificial,clinical problems,1  
N99 Trastornos del aparato genitourinario posteriores a procedimientos, no clasificados en otra parte,clinical problems,1  
O00 Embarazo ectópico,clinical problems,1  
O01 Mola hidatiforme,clinical problems,1  
O02 Otros productos anormales de la concepción,clinical problems,1  
O03 Aborto espontáneo,clinical problems,1  
O04 Aborto provocado por razones médicas y legales,clinical problems,1  
O05 Otros tipos de aborto provocado,clinical problems,1  
O06 Aborto no especificado,clinical problems,1  
O07 Fracaso de intento de aborto,clinical problems,1  
O08 Complicaciones posteriores a un aborto y embarazo ectópico o molar,clinical problems,1  
O10 Hipertensión preexistente con embarazo parto y puerperio,clinical problems,1  
O11 Trastornos hipertensivos preexistentes con proteinuria superpuesta,clinical problems,1  
O12 Edema proteinuria y trastornos hipertensivos del embarazo parto y puerperio,clinical problems,1  
O13 Hipertensión gestacional sin proteinuria,clinical problems,1  
O14 Preeclampsia,clinical problems,1  
O15 Eclampsia,clinical problems,1  
O16 Trastorno hipertensivo no especificado en el embarazo parto y puerperio,clinical problems,1  
O20 Hemorragia en el embarazo temprano,clinical problems,1  
O21 Hiperemesis gravídica,clinical problems,1  
O22 Complicaciones venosas en el embarazo,clinical problems,1  
O23 Infección del tracto urinario en el embarazo,clinical problems,1  
O24 Diabetes mellitus en el embarazo,clinical problems,1  
O25 Desnutrición en el embarazo,clinical problems,1  
O26 Trastornos relacionados con el embarazo en general,clinical problems,1  
O28 Resultados anormales en exámenes prenatales,clinical problems,1  
O29 Complicaciones de la anestesia administrada durante el embarazo,clinical problems,1  
O30 Embarazo múltiple,clinical problems,1  
O31 Otras complicaciones específicas del embarazo múltiple,clinical problems,1  
O32 Madre con presentación anormal del feto,clinical problems,1  
O33 Madre con desproporción entre feto y pelvis,clinical problems,1  
O34 Madre con anomalías de los órganos pélvicos,clinical problems,1  
O35 Madre con sospecha de daño fetal,clinical problems,1  
O36 Otras afecciones maternas relacionadas con el feto,clinical problems,1  
O40 Polihidramnios,clinical problems,1  
O41 Trastornos de las membranas amnióticas,clinical problems,1  
O42 Ruptura prematura de membranas,clinical problems,1  
O43 Trastornos de la placenta,clinical problems,1  
O44 Placenta previa,clinical problems,1  
O45 Desprendimiento prematuro de placenta,clinical problems,1  
O46 Hemorragia anteparto no clasificada en otra parte,clinical problems,1  
O47 Falso trabajo de parto,clinical problems,1  
O48 Embarazo prolongado,clinical problems,1  
O60 Trabajo de parto prematuro,clinical problems,1  
O61 Fracaso en la inducción del trabajo de parto,clinical problems,1  
O62 Anormalidades en la contracción uterina,clinical problems,1  
O63 Trabajo de parto prolongado,clinical problems,1  
O64 Obstrucción del trabajo de parto por presentación anormal,clinical problems,1  
O65 Obstrucción del trabajo de parto por desproporción,clinical problems,1  
O66 Otras formas de trabajo de parto obstruido,clinical problems,1  
O67 Hemorragia durante el trabajo de parto,clinical problems,1  
O68 Trastornos fetales durante el trabajo de parto,clinical problems,1  
O69 Complicaciones relacionadas con el cordón umbilical,clinical problems,1  
O70 Desgarro del periné durante el parto,clinical problems,1  
O71 Otros traumatismos obstétricos durante el parto,clinical problems,1  
O72 Hemorragia posparto,clinical problems,1  
O73 Retención de placenta o membranas sin hemorragia,clinical problems,1  
O74 Complicaciones de la anestesia administrada durante el trabajo de parto y el parto,clinical problems,1  
O75 Otras complicaciones del trabajo de parto y del parto no clasificadas en otra parte,clinical problems,1  
O80 Parto único espontáneo,clinical problems,1  
O81 Parto único asistido con fórceps o ventosa,clinical problems,1  
O82 Parto único por cesárea,clinical problems,1  
O83 Otros tipos de parto único asistido,clinical problems,1  
O84 Parto múltiple,clinical problems,1  
O85 Sepsis puerperal,clinical problems,1  
O86 Otras infecciones puerperales,clinical problems,1  
O87 Complicaciones venosas puerperales,clinical problems,1  
O88 Embolia obstétrica,clinical problems,1  
O89 Complicaciones de la anestesia durante el puerperio,clinical problems,1  
O90 Complicaciones del puerperio no clasificadas en otra parte,clinical problems,1  
O91 Infecciones de la mama relacionadas con el parto,clinical problems,1  
O92 Otras afecciones de la mama y de la lactancia,clinical problems,1  
O95 Muerte materna por causas obstétricas no especificadas,clinical problems,1  
O96 Muerte materna por causas obstétricas más de 42 días después del parto,clinical problems,1  
O97 Muerte materna por secuelas de causas obstétricas directas,clinical problems,1  
O98 Enfermedades infecciosas y parasitarias maternas clasificadas en otra parte,clinical problems,1  
O99 Otras enfermedades maternas no clasificadas en otra parte,clinical problems,1  
P00 Feto y recién nacido afectados por enfermedades maternas que pueden estar relacionadas con el embarazo,clinical problems,1  
P01 Feto y recién nacido afectados por complicaciones maternas del embarazo,clinical problems,1  
P02 Feto y recién nacido afectados por complicaciones de la placenta el cordón umbilical y las membranas,clinical problems,1  
P03 Feto y recién nacido afectados por otros trastornos del parto y del trabajo de parto,clinical problems,1  
P04 Feto y recién nacido afectados por influencias nocivas transmitidas por la placenta o la leche materna,clinical problems,1  
